{
  "$schema": "https://civitasconnect.digital/core-dataset/v1#/$defs/Mapping",
  "id":     "urn:core:platform:civitas:mapping:smartmeter:c508c787-1aaf-8f20-aca4-7a037ea54917:1.0.0",
  "title":  "SMLReading Wirkleistung Bezug → STA Observation",
  "source": "urn:core:platform:civitas:element:smartmeter:76837a37-9208-8227-b886-e4de559d9479:1.0.0",
  "target": "urn:core:platform:civitas:element:sta:61296fa8-8cca-8d83-af42-51e12c991cd8:1.0.0",
  "fields": {
    "phenomenonTime": { "op": "copy", "input": "$.timestamp" },
    "resultTime":     { "op": "copy", "input": "$.timestamp" },
    "result":         { "op": "copy", "input": "$.activePowerPlus.value" },
    "resultQuality":  { "op": "copy", "input": "$.activePowerPlus.quality" },
    "Datastream.@iot.id": { "op": "copy", "input": "$.frostDatastreamIds.activePowerPlus" }
  }
}
