{
  "$schema": "https://civitasconnect.digital/core-dataset/v1#/$defs/Mapping",
  "id": "urn:core:platform:civitas:mapping:taf10-grid:b1c986af-3704-8713-b36d-95bda5ff5766:1.0.0",
  "title": "TAF10 Active Power Minus -> STA Observation",
  "source": "urn:core:platform:civitas:element:taf10-grid:fb8586b6-92ea-8bca-a3a7-a8e99a377b83:1.0.0",
  "target": "urn:core:platform:civitas:element:sta:61296fa8-8cca-8d83-af42-51e12c991cd8:1.0.0",
  "fields": {
    "phenomenonTime": { "op": "copy", "input": "$.timestamp" },
    "resultTime": { "op": "copy", "input": "$.timestamp" },
    "result": { "op": "copy", "input": "$.activePowerMinus.value" },
    "resultQuality": { "op": "copy", "input": "$.activePowerMinus.quality" },
    "parameters.gridNodeId": { "op": "copy", "input": "$.gridNodeId" },
    "parameters.observedProperty": { "op": "const", "value": "activePowerMinus" },
    "parameters.unit": { "op": "copy", "input": "$.activePowerMinus.unit" },
    "Datastream.@iot.id": { "op": "copy", "input": "$.frostDatastreamIds.activePowerMinus" }
  }
}
